{
  "risks_id": "RISKS-SONNY-20260201-070719",
  "plan_id": "PLAN-SONNY-20260201-070640",
  "run_id": "RUN-SONNY-20260201-070640",
  "generated_at": "2026-02-01T07:07:19.668167Z",
  "summary": {
    "total_risks": 0,
    "by_severity": {
      "CRITICAL": 0,
      "HIGH": 0,
      "MEDIUM": 0,
      "LOW": 0
    },
    "by_category": {},
    "actionable_count": 0,
    "suppressed_count": 0
  },
  "risks": [],
  "suppressed": []
}